budget,popularity,revenue,runtime,tagline,title,vote_average,vote_count
20000000,3.011205,15473333,199,,The Greatest Story Ever Told,6.5,41
19500000,15.012237,34854990,111,The truth lies in the most unexpected places.,Secret in Their Eyes,6.2,336
25000000,16.238961,14109284,87,Your favorite movies are going to be destroyed.,Disaster Movie,3,240
20000000,15.21229,22942221,88,Who will be the last man standing?,Armored,5.5,208
20000000,6.397042,13801755,97,"He’s on a mission so secret, even he doesn’t know about it.",The Man Who Knew Too Little,6.5,125
20000000,19.220789,30426096,106,Ally's looking for the best ex of her life.,What's Your Number?,6.2,671
20000000,35.232278,32204030,95,Take no prisoners.,Lockout,5.8,715
40000000,9.842771,0,99,"Success didn’t go to his head, it went to his neighbor.",Envy,4.8,139
20000000,35.542809,34560577,96,"Stay Charged, Stay Alive!",Crank: High Voltage,5.9,861
0,7.829295,0,98,,Bullets Over Broadway,7,130
20000000,3.476925,13391174,123,Feel The Touch Of Destiny,One Night with the King,6.1,12
30000000,5.133744,27674124,101,,The Quiet American,6.4,81
20000000,14.031377,12482775,101,Dave Spritz is about to take his best shot . . . at life,The Weather Man,6,289
20000000,17.227376,12398628,96,Two Enemies ... The Mob ... The Ultimate Showdown.,Undisputed,6.1,139
0,17.98817,0,102,He sees dead people... and they annoy him.,Ghost Town,6.4,286
20000000,15.66135,17280326,108,Survive all 12,12 Rounds,5.7,220
20000000,19.705311,24145613,116,Innocence dies. Abby doesn't.,Let Me In,6.7,641
0,2.645722,0,93,"Colt, Rocky and Tum Tum are back for bigger kicks in an all new adventure",3 Ninjas Kick Back,4.5,48
0,17.662683,0,102,"You name it, we shoot it.",Be Kind Rewind,6.2,424
0,2.894154,0,103,,Mrs Henderson Presents,6.4,62
20000000,29.371987,12639297,115,The Code on the Street is Never Black & White,Triple 9,5.6,797
20000000,11.352693,10686841,96,Harry Block has written a best seller... bout his best friends... he revealed their deepest secrets... and they're not pleased... now Harry Block is going to Hell...,Deconstructing Harry,7.3,187
20000000,7.553773,0,98,All's fair in the war of love.,Three to Tango,5.4,62
20000000,30.477114,36606743,100,Never underestimate a man with everything to lose.,Burnt,6.3,950
20000000,9.927018,0,106,Escaped convicts disguised as priests. It'll take a miracle to get away with this one.,We're No Angels,5.6,105
20000000,12.379781,0,101,,Everyone Says I Love You,6.5,147
20000000,12.643703,16974459,105,Protect what's yours.,Death Sentence,6.5,297
21000000,15.440465,0,99,Frank's travelling light but carrying excess baggage.,Everybody's Fine,6.5,284
0,5.886228,9109322,88,Meet the new generation of superheroes.,Superbabies: Baby Geniuses 2,1.9,35
0,6.925645,12382362,83,One guy walks the walk. The other talks and talks.,The Man,5.4,133
20000000,9.36146,10337477,84,,Code Name: The Cleaner,4.7,78
20000000,6.102663,11341016,98,"When you follow your dream, there's no telling what you'll become.",Connie and Carla,6.4,24
8000000,0.709143,20000000,149,Love is what it's all about!,Sweet Charity,6.5,15
20000000,45.742217,11110975,148,"Under the paving stones, the beach!",Inherent Vice,6.5,833
0,1.682839,0,85,Things are about to get hairy.,Doogal,3.2,18
20000000,8.237336,16549477,110,The World is watching,Battle of the Year,5.9,88
20000000,2.605374,7000000,83,Laugh like you're country depends on it.,An American Carol,4.1,20
12000000,29.072964,15008161,107,Trained to kill. Left for dead. Back for more.,Machete Kills,5.3,631
22000000,1.322528,0,100,"When the cat's away, the rats will play.",Willard,5.8,82
0,4.961306,6575282,87,This ain't March of the Penguins.,Strange Wilderness,4.7,69
0,8.628519,0,160,Gilbert & Sullivan & So Much More,Topsy-Turvy,6.7,41
20000000,12.232048,6420319,106,Believe the impossible.,Little Boy,7,185
15000000,27.133277,27462041,99,Why deny what you desire the most.,A Dangerous Method,6.2,571
8700000,26.093043,7659918,100,Everything Is Not Going To Be OK,A Scanner Darkly,6.8,532
0,13.621201,0,117,Legends Start Somewhere,Chasing Mavericks,7,216
20000000,9.292987,10442808,96,Can mankind defeat the army of darkness unleashed by an ancient evil cult?,Alone in the Dark,3.1,173
20000000,7.716606,5210988,111,Band Together,Bandslam,5.4,126
20000000,7.698075,0,100,Be careful what you wish for.,Birth,5.9,179
20000000,37.629309,12007070,125,The result is never in question. Just the path you take to get there.,A Most Violent Year,6.5,546
0,2.405911,0,114,,Passchendaele,6.3,26
0,3.350297,0,119,"Corporations have time, money, and power on their side. All Bob Kearns had was the truth.",Flash of Genius,6.3,59
20000000,13.032308,4001121,135,All I Can Do Is Be Me Whoever That Is,I'm Not There.,6.6,195
20000000,15.131867,16863583,93,Be careful who you trust.,The Cold Light of Day,4.8,271
20000000,10.218307,5530764,114,They'd never let the truth come between them.,The Brothers Bloom,6.8,203
21000000,12.761176,0,124,,"Synecdoche, New York",7.4,278
26500000,60.732738,159375308,134,The Fate Of The World Rests On The Courage Of One Warrior.,Princess Mononoke,8.2,1983
0,0.49446,0,114,,Bon voyage,5.7,20
0,6.574285,0,124,The Musical Comedy Smash of the 80's!,Can't Stop the Music,4.9,9
2000000,14.617944,5048693,104,This land will be civilized.,The Proposition,7.1,218
20000000,3.102987,0,118,Hope never quits,My All American,6.8,36
20000000,5.65327,1675706,84,Uptown Gets Down.,Marci X,3.3,12
20000000,44.566609,5359645,107,"In a future where freedom is outlawed, outlaws will become heroes.",Equilibrium,6.9,1552
40000000,8.978408,7400000,125,"War made them orphans, one man made them legends",The Children of Huang Shi,6.5,52
0,10.150993,0,115,He's the target of the most merciless family in New York. His own.,The Yards,6,97
0,0.28576,0,88,,The Oogieloves in the Big Balloon Adventure,2.2,8
10000000,11.267676,3727746,122,,By the Sea,5.4,156
20000000,9.129808,0,126,He will save the future.,Steamboy,6.4,102
0,2.013405,0,101,,The Game of Their Lives,5.8,14
0,20.086645,0,101,The perfect love story. Until it became the perfect crime.,All Good Things,5.9,286
20000000,3.581906,305070,107,,Rapa Nui,6.2,33
0,12.373248,47301471,86,It's out of this world.,CJ7,6.1,107
0,12.283025,0,118,They come back!,The Visitors II: The Corridors of Time,5.8,221
20000000,10.617236,4634062,107,No pulse? No problem,Dylan Dog: Dead of Night,4.5,139
20000000,6.377308,0,100,,People I Know,5.5,48
20000000,3.620537,346594,110,,The Tempest,6,31
0,27.215666,17671101,106,Fear always finds its victim,Regression,5.3,585
0,4.127155,0,102,,Three Kingdoms: Resurrection of the Dragon,6.6,35
20000000,13.118983,0,95,Lives will be broken,Butterfly on a Wheel,6.3,130
20000000,14.182301,0,83,Airborne to be wild.,Zambezia,5.3,68
0,0.416179,0,170,,Ramanujan,5,3
0,0.485405,0,98,,Dwegons,0.5,1
20000000,7.444189,0,105,No más. No surrender.,Hands of Stone,6.1,109
20000000,33.625477,0,96,His Next Target is Now Hunting Him,Survivor,5.4,404
27220000,28.060472,5496951,105,The hunter becomes the hunted,The Frozen Ground,6.1,465
19400000,20.746932,0,125,Sometimes the greatest journey is the distance between two people.,The Painted Veil,7.1,312
27000000,7.727035,0,150,,The Baader Meinhof Complex,7.1,157
22000000,45.707835,424208848,181,Inside everyone is a frontier waiting to be discovered.,Dances with Wolves,7.6,1046
20000000,28.497242,216197492,92,She doesn't give an F.,Bad Teacher,5.4,1584
19000000,11.47316,110879513,113,Deception is dangerous. Desire is deadly.,Sea of Love,6.7,141
19000000,25.28132,70067909,95,Once upon a time... can happen any time.,A Cinderella Story,6.1,713
14000000,45.99611,173046663,111,Someone has taken their love of scary movies one step too far.,Scream,7,1476
0,20.392858,0,91,"There are ghosts around us all the time. Most of them don't want to hurt us. But, there are exceptions...",Thir13en Ghosts,5.4,440
19000000,78.699993,44017374,144,A masterpiece of modern horror.,The Shining,8.1,3757
19000000,76.603233,381109762,116,He's the only kid ever to get into trouble before he was born.,Back to the Future,8,6079
19000000,13.664614,40846082,93,Evil loves to party.,House on Haunted Hill,5.5,209
0,2.242809,0,113,,I Can Do Bad All By Myself,6,40
27000000,1.224105,0,90,One way in. No way out.,Fight Valley,3.9,8
19000000,27.494037,49830607,101,The most unexpected comedy ever conceived.,The Switch,5.9,583
18000000,18.47518,101564935,95,Welcome to the honeymoon from hell.,Just Married,5.3,404
19100000,10.559414,5728213,109,"The 80's were brilliant, if you were in charge.",The Devil's Double,6.5,208
0,1.916351,0,85,Little Engines CAN Do Big Things...,Thomas and the Magic Railroad,4.6,8
20000000,28.867568,54956140,101,Fear Thy Neighbor,The Crazies,6.2,633
15000000,118.968562,274925095,125,The tunnel led Chihiro to a mysterious town...,Spirited Away,8.3,3840
0,3.376967,0,110,,Firestorm,5.9,43
25000000,7.436491,8613462,132,"After 200 years, the truth behind the legend.",The Bounty,6.5,108
0,57.84156,76586316,131,Courage beyond words.,The Book Thief,7.4,1486
19000000,17.952817,18755936,109,He's leaving virgin territory,Sex Drive,6,342
19000000,21.959742,29922472,100,Anna planned to propose to her boyfriend on February 29th. This is not her boyfriend.,Leap Year,6.4,465
19000000,4.229942,4750000,188,The Most Magnificent Re-Creation . . . Of An Ancient Empire . . . Launches A New Epoch In Motion Pictures . . .,The Fall of the Roman Empire,6,33
19000000,11.766564,6928068,97,Best. Night. Ever.,Take Me Home Tonight,6.2,208
0,2.366251,5310554,121,If you can't beat the system... change it,Won't Back Down,5.8,40
19000000,0.068228,2119994,93,The joy of the New York City Ballet in an exciting family holiday motion picture.,The Nutcracker,5.6,5
18000000,5.380733,0,116,"Kansas City, 1934. Anything could happen here. One night it did.",Kansas City,6.1,12
0,5.625989,0,110,Based on the novel by Philip Roth.,Indignation,6.8,69
19000000,30.205943,108047131,90,What happened over the next 28 days has never been explained.,The Amityville Horror,6,588
19000000,26.441669,32801173,114,"From the creator of Being John Malkovich, comes the story about the creator of Being John Malkovich.",Adaptation.,7.3,638
15000000,15.262492,46770602,93,The dead shall inherit the Earth.,Land of the Dead,6,381
0,1.583918,0,107,,Out of Inferno,5.8,11
18500000,44.511363,10680275,118,"Buy the ticket, take the ride.",Fear and Loathing in Las Vegas,7.2,1301
18500000,16.665841,31912793,100,In a world where everyone can only tell the truth... This guy can lie.,The Invention of Lying,6,518
18000000,36.471231,268157400,96,Family vs. Frat,Neighbors,6.2,2713
23000000,85.30318,351583407,101,From zero to hero.,The Mask,6.6,2472
18000000,20.716023,151668774,104,You're Only Young Once But For Josh It Might Just Last A Lifetime.,Big,6.9,993
18000000,29.487784,261572744,82,"Come to Kazakhstan, it's nice!",Borat: Cultural Learnings of America for Make Benefit Glorious Nation of Kazakhstan,6.5,1579
18000000,25.43954,141774679,96,Don't judge a book by its hair color!,Legally Blonde,6.1,882
18000000,15.314027,87000000,105,A dying planet. A fight for life.,Star Trek III: The Search for Spock,6.4,434
19000000,32.602868,144216468,122,What happened to Emily?,The Exorcism of Emily Rose,6.3,659
17000000,9.832326,65535067,88,He charges $10 but he’s willing to negotiate.,Deuce Bigalow: Male Gigolo,5.5,308
16000000,33.452469,19682924,110,The End Begins,Left Behind,3.7,392
0,14.190837,0,103,Feel The Love,The Family Stone,6.2,249
18000000,6.501815,65070412,106,Let your hair down,Barbershop 2:  Back in Business,5.6,74
23000000,26.58873,76488889,91,He doesn't care if you're naughty or nice.,Bad Santa,6.5,656
16500000,36.15716,67683989,94,"If he were any cooler, he'd still be frozen, baby!",Austin Powers: International Man of Mystery,6.5,1013
18000000,16.027955,88923251,94,People change. Greeks don't.,My Big Fat Greek Wedding 2,5.5,322
21000000,14.329891,72417394,99,Welcome to the next grade,Diary of a Wimpy Kid: Rodrick Rules,6.3,238
18000000,50.009408,98235548,107,"If it bleeds, we can kill it...",Predator,7.3,2093
18000000,31.82675,51973029,160,...Everything you've heard is true,Amadeus,7.8,1076
0,9.642041,14796236,88,A Night To Die For.,Prom Night,4.8,167
17000000,36.423717,129042871,97,Welcome to girl world.,Mean Girls,6.9,2320
0,12.309718,0,113,Life offers you a thousand chances ... all you have to do is take one.,Under the Tuscan Sun,6.4,172
19800000,11.693272,87754044,137,Tea at four. Dinner at eight. Murder at midnight.,Gosford Park,6.8,246
18000000,12.243887,41382841,103,"Knowing what you know now, what would you do differently?",Peggy Sue Got Married,5.9,136
18000000,89.811154,103215094,119,or (The Unexpected Virtue of Ignorance),Birdman,7.4,4535
18000000,34.694216,99206215,98,Blue Moon. I used to know the words. Now they're all a jumble.,Blue Jasmine,7,1098
15000000,17.50138,76286096,111,"September 11, 2001. Four planes were hijacked. Three of them reached their target. This is the story of the fourth.",United 93,6.9,367
18000000,18.492655,62646763,94,Her dream. Her terms,Honey,6,303
18000000,11.238522,0,81,All the action. All the women. Half the intelligence.,Spy Hard,4.9,147
1000000,14.518598,21378361,89,Lock your doors. Bolt your windows. There's something in THE FOG!,The Fog,6.4,311
18000000,19.234672,47088990,106,"When you come back from a loss, beat the odds, and never say never, you find a champion.",Soul Surfer,6.9,342
18000000,4.504377,24911670,121,,Catch-22,6.7,72
0,10.529143,24007324,86,"Right now, the world needs a hero.",Observe and Report,5.6,225
18000000,18.379124,100000000,103,The most powerful legend of all is back in a new adventure.,Conan the Destroyer,5.8,383
18000000,35.524457,23000000,129,,Raging Bull,7.7,938
18000000,13.472365,36133014,109,Sometimes when you least expect it...,Love Happens,5.6,180
18000000,8.321586,0,109,"Before a lifetime of adventure, they lived the adventure of a lifetime.",Young Sherlock Holmes,6.7,167
0,7.668063,0,107,,Fame,5.5,135
18000000,52.464877,35692920,94,There is no force more powerful than the will to live.,127 Hours,7,2606
0,11.423533,0,94,They took a bite out of crime,Small Time Crooks,6.4,155
18000000,6.961736,17200925,115,Life doesn't hold tryouts.,Center Stage,6.8,90
17000000,9.191187,24000000,107,"Christmas means comfort, joy and chaos.",Love the Coopers,5.4,167
18000000,4.492859,16702864,92,They're on a mission without permission.,Catch That Kid,4.9,76
18000000,5.706767,0,125,"Seen from a distance, it's perfect.",Life as a House,7.2,120
30000000,53.670525,34441873,122,Can a great man be a good man?,Steve Jobs,6.8,1573
18000000,14.15192,0,102,Popularity is nice. Popular girls are not.,"I Love You, Beth Cooper",5.1,197
18000000,13.462544,0,87,"Every ""Revolution"" Needs A Leader",Youth in Revolt,5.9,319
18000000,11.725805,2945600,98,"The untold story of the man behind the mask, and the legend behind the man.",The Legend of the Lone Ranger,3.7,14
21000000,7.047975,28008462,109,"In a place this treacherous, what a good spy needs is a spy of his own.",The Tailor of Panama,6.2,92
18000000,13.628601,12000000,108,Murder has a sound all of its own!,Blow Out,7.3,236
18000000,16.520516,10501938,90,Get in. Get out. Getaway.,Getaway,4.9,246
18000000,14.916264,8038061,112,"It was 1973, and the climate was changing.",The Ice Storm,6.9,176
18000000,9.633711,25312387,94,,And So It Goes,5.7,164
0,3.455018,0,105,"When the going gets tough, the tough go shopping!",Troop Beverly Hills,5.6,56
0,1.946634,0,104,Passion. Obsession. Revenge. Prepare for the performance of a lifetime.,Being Julia,6.4,23
17000000,12.313143,6735922,117,They Broke Every Rule,Nine 1/2 Weeks,5.8,177
18000000,3.258422,14110013,108,"In the Dark Ages, Magic was a weapon. Love was a mystery. Adventure was everywhere... And Dragons were real.",Dragonslayer,6.5,67
0,3.659292,0,112,Intoxicating. Infuriating. Impossible. Love.,The Last Station,6.7,55
18000000,24.548633,5887457,127,"When it came to making bad movies, Ed Wood was the best.",Ed Wood,7.3,630
18000000,17.683563,20275812,111,,Labor Day,6.7,299
18000000,10.1449,26527510,120,Greatness comes to those who take it.,Mongol: The Rise of Genghis Khan,6.5,158
18000000,31.887978,25739015,114,"A story of sex, thugs and rock 'n roll.",RockNRolla,6.9,836
0,1.110179,0,99,Deeds not Words,Megaforce,3.5,15
0,9.814785,0,242,,Hamlet,7.3,117
25000000,1.876811,20719451,117,最后的舞者,Mao's Last Dancer,6.8,28
18000000,32.717853,6212282,112,He's not like us.,Midnight Special,6.2,694
0,8.945081,0,108,In any relationship one person always does the heavy lifting.,Anything Else,6.2,149
18000000,13.916583,22309223,116,Revenge is never a straight line.,The Railway Man,6.7,273
15238800,17.94739,0,144,,The White Ribbon,7.2,255
0,2.525569,0,90,,Restoration,5.3,11
2700000,10.47644,3500000,93,He's not from around here...,The Wraith,5.9,108
18000000,10.991281,676698,103,"If you're looking for the truth, you've come to the wrong place.",Salton Sea,7,104
18000000,7.871686,7972967,93,Experience Metallica like never before,Metallica: Through the Never,6.7,83
18000000,6.333869,382174,98,Greed is good. Sex is easy. Youth is forever.,The Informers,4.4,60
18000000,1.138383,871279,338,The man who hijacked the world,Carlos,6.7,50
18000000,8.266124,0,114,,I Come with the Rain,5.6,20
0,0.910529,0,121,One man's hero is another man's traitor.,One Man's Hero,9.3,2
3500000,18.025206,34000000,96,The darkest day of horror the world has ever known.,Day of the Dead,6.9,270
18000000,10.144222,0,92,I lay my vengeance upon them.,I Am Wrath,4.5,179
18000000,9.244181,1831348,105,Paris 2054. Live forever or die trying,Renaissance,6.7,77
17900000,12.752463,6948633,89,A woman and a warrior that became a legend.,Red Sonja,5,206
14000000,22.748174,13551174,119,How much do you want to believe?,Red Lights,6,376
20000000,33.436092,121463226,113,Come and Get Some!,Superbad,7,2100
0,3.107371,90508336,103,,Madea Goes to Jail,6.4,52
18000000,7.922639,0,90,Unleash the beast,Wolves,5.7,82
23000000,28.973074,150816700,98,It's not where you're from. It's where you're at.,Step Up 2: The Streets,6.5,640
15000000,23.980329,51053787,80,Armed And Dangerously Dumb.,Hoodwinked!,5.9,479
17500000,28.60542,38000000,121,"When the world closed its eyes, he opened his arms.",Hotel Rwanda,7.5,793
24000000,42.669304,99965753,89,Assassin 47,Hitman,5.9,966
17500000,7.180403,7018189,93,The Musical Event of the Holiday Season,Black Nativity,5.8,16
18000000,21.638673,266586800,93,Mercy is for the Weak,The Prince,4.6,218
0,2.64486,0,116,,City of Ghosts,5.4,18
0,25.881355,0,101,"Sooner or later she'll see them, then everything will be different.",The Others,7.4,1660
18500000,67.66094,183316455,137,This Time It's War,Aliens,7.7,3220
17000000,20.786616,72070731,170,The loverliest motion picture of them all!,My Fair Lady,7.4,352
17000000,27.654472,125586134,100,"If you're going to bury the truth, make sure it stays buried.",I Know What You Did Last Summer,5.6,687
17000000,70.668923,136621271,104,Fake Cops. Real Trouble.,Let's Be Cops,6.4,1219
16000000,23.425431,109502303,126,In search of wine. In search of women. In search of themselves.,Sideways,6.9,478
17500000,14.304444,19179969,110,Prepare for the ultimate chug of war.,Beerfest,5.8,172
300000,30.301307,70000000,91,The Night He Came Home,Halloween,7.4,1035
17000000,3.56033,0,87,Rover is about to take over.,Good Boy!,4.7,30
17000000,7.210095,71625195,123,Times change. Friendship doesn't.,The Best Man Holiday,6.7,110
17000000,23.491962,57103895,109,Nobody gets away clean.,Smokin' Aces,6.4,534
20000000,36.133536,136150434,90,The Traps Come Alive,Saw: The Final Chapter,5.8,730
17000000,14.18136,0,94,Easier said than done.,40 Days and 40 Nights,5.2,297
17000000,12.709227,30331165,81,Score!,A Night at the Roxbury,5.9,198
17000000,24.054062,43165571,86,Love is never ugly.,Beastly,6,849
15000000,35.107857,69623713,107,The lucky ones die first.,The Hills Have Eyes,6.1,705
0,10.149569,0,98,50 million people used to watch him on TV. Now he washes their cars.,Dickie Roberts: Former Child Star,5.1,64
0,14.023082,45710059,128,Champions Can Come From Anywhere.,"McFarland, USA",7.4,213
0,9.054803,0,99,Winning is Just the Beginning Surviving is Another Story,Lottery Ticket,5.6,54
20000000,5.422285,21170563,105,A New American Story,ATL,6,32
17000000,32.746486,115350426,112,Get pitch slapped.,Pitch Perfect,7.3,2247
34000000,3.960098,19693891,108,Are you game?,Summer Catch,4.8,63
0,10.178917,0,121,Sometimes good people do evil things.,A Simple Plan,6.9,187
17000000,4.544216,0,89,Are you afraid of the dark? You should be.,They,4.6,74
0,2.184708,0,89,,Larry the Cable Guy: Health Inspector,3.3,17
0,3.09159,0,73,"The Good, The Bad and The Stinky.",The Adventures of Elmo in Grouchland,6.3,14
17000000,18.790102,29536299,133,This is War. This is Brooklyn.,Brooklyn's Finest,6.2,293
17000000,3.321095,10000000,154,A handful of men and women held out against the frenzied hordes of bloodthirsty fanatics!,55 Days at Peking,6.3,36
17000000,33.912116,97542952,91,The most terrifying film you will ever experience.,Evil Dead,6.4,1723
17000000,5.787891,20455276,95,The most fun you can have without a passport.,My Life in Ruins,5.6,101
17000000,7.864011,7314027,107,Imagine a country where more people vote for a pop idol than they do for their next President.,American Dreamz,4.9,95
17000000,17.062117,19300000,90,"Nuclear Power. In the best hands, it is dangerous. In the hands of Lex Luthor, it is pure evil. This is Superman's greatest battle. And it is for all of us.",Superman IV: The Quest for Peace,4.1,318
0,1.782666,0,94,,How She Move,3,6
17000000,19.311572,9500000,122,Every bullet leaves a trail.,Running Scared,7,331
0,2.897449,0,120,,Bobby Jones: Stroke of Genius,5.5,19
17000000,0.138564,0,97,A romantic adventure for the dangerous at heart.,Shanghai Surprise,2.9,15
40000000,36.960953,86915017,110,Nothing Is What It Seems.,The Illusionist,7.1,1615
17000000,1.15641,2000000,102,No animals were harmed in the making of this movie. 70 members of the cast and crew were.,Roar,5.6,19
17000000,9.583578,1569918,98,Why would anyone want to kill Veronica Guerin?,Veronica Guerin,6.8,59
17000000,25.112567,3758328,120,Welcome to the family,Escobar: Paradise Lost,6.1,271
17000000,9.349386,374743,144,Have a nice apocalypse.,Southland Tales,5.2,153
15000000,8.884405,0,80,Dragon hunting isn't a fairy tale,Dragon Hunters,6.5,129
17000000,2.215261,8720000,91,,Damnation Alley,5,27
17000000,6.385234,9627492,82,Once You Believe You Die,The Apparition,4.5,140
16500000,20.935169,0,102,"When your Dad's an undertaker, your Mom's in heaven, and your Grandma's got a screw loose...it's good to have a friend who understands you. Even if he is a boy.",My Girl,7,428
16800000,4.358255,2281089,122,A love story.,Fur: An Imaginary Portrait of Diane Arbus,5.8,73
15000000,24.898687,43848069,126,Every dream has a price.,Wall Street,7,546
16500000,20.898711,135000000,136,Lose your heart and come to your senses.,Sense and Sensibility,7.2,352
16500000,18.236284,37311672,120,Her own life is her greatest inspiration.,Becoming Jane,6.9,317
16500000,10.74648,13620075,108,Freshman year is no fairytale,Sydney White,6,236
16500000,12.102725,16942795,126,Some dreams can't be shared.,House of Sand and Fog,7,199
16400000,55.458584,235860116,129,He was their inspiration. He made their lives extraordinary.,Dead Poets Society,8.1,2705
16000000,35.777067,247275374,107,"What the one doesn't have, the other is missing.",Dumb and Dumber,6.5,1859
16000000,18.430419,92823546,96,Can two friends sleep together and still love each other in the morning?,When Harry Met Sally...,7.3,950
16000000,7.980632,53977250,129,"The doctors want to settle, the Church wants to settle, their lawyers want to settle, and even his own clients are desperate to settle. But Galvin is determined to defy them all. He will try the case.",The Verdict,7.4,131
16000000,14.759948,119754278,93,The greatest college tradition of all.,Road Trip,5.9,542
0,9.229999,0,106,It takes a hero to know what's worth winning.,Varsity Blues,6,122
15000000,29.943316,133432856,100,A Breath Of Fresh Vintage Air,The Artist,7.3,1049
16000000,15.788784,76514050,87,Evil will do anything to live.,The Unborn,4.8,365
16000000,41.083914,68263166,94,A tormenting and surprising story of children and adults during the stormy days of the summer of 1965.,Moonrise Kingdom,7.6,1662
16000000,21.380635,0,91,What you know about fear... doesn't even come close.,The Texas Chainsaw Massacre: The Beginning,5.9,402
18500000,1.884558,6490401,120,"Before he was the savior, he was a child.",The Young Messiah,6.4,30
0,4.382761,0,80,He can get into any disguise... getting out is another story.,The Master of Disguise,3.7,78
19000000,90.809408,83258226,118,What happens when make-believe believes it's real?,Pan's Labyrinth,7.6,3041
0,6.579017,0,94,The Smart One Isn't Wearing Any Pants.,See Spot Run,4.8,44
16000000,7.854989,29381649,130,Just a Baby Boy.,Baby Boy,7.4,55
16000000,11.807269,40492759,91,"2,000 colleges. 8 million roommates. Which one will you get?",The Roommate,5.3,224
17700000,15.976335,30987695,91,He Came. He Cleaned. He Conquered.,Joe Dirt,5.5,242
15000000,10.484642,30102717,110,Two brothers separated by the violence. Now together in a mission of revenge.,Double Impact,5.3,215
12000000,38.623178,80573774,121,Big cops. Small town. Moderate violence.,Hot Fuzz,7.4,2199
16000000,8.8321,50007546,114,,The Women,4.6,96
15000000,32.758254,96408652,96,Life is the ultimate work of art,Vicky Cristina Barcelona,6.7,1020
25000000,6.091033,0,139,A Knight in the Holy Land. A Woman in the Frozen North. A War that Kept Them Apart.,Arn: The Knight Templar,6.4,76
16000000,9.119797,20627372,94,Warning: Sex Changes Everything,Boys and Girls,5.4,103
