budget,popularity,revenue,runtime,tagline,title,vote_average,vote_count
7000000,8.079046,14618727,116,"Open your heart, find your voice.",Beyond the Lights,7,139
7000000,21.626288,0,101,,A Single Man,7.3,463
7000000,14.672151,8373585,164,,The Last Temptation of Christ,7,201
7000000,2.627232,7292175,96,Tim's getting a future... whether he likes it or not!,Outside Providence,5.6,30
7000000,12.150871,0,111,Bollywood meets Hollywood... And it's a perfect match,Bride & Prejudice,6.5,110
0,2.128211,0,94,"Follow Your Heart, Follow The Fence",Rabbit-Proof Fence,6.8,84
0,2.881239,0,93,,Who's Your Caddy?,3.8,18
7,4.857028,5,90,He's seen the future. Now he has to kill it.,Split Second,5.7,63
7000000,2.206097,4720371,113,An Epic Journey.,The Other Side of Heaven,6.7,14
7000000,3.721858,29385320,192,A Love Legend,Veer-Zaara,7.4,64
7000000,5.091253,0,99,There's always a way out. You just have to find it.,Redbelt,6.4,76
7000000,15.212569,0,91,John met the woman of his dreams. Then he met her son ...,Cyrus,6.1,133
0,0.838938,0,96,,A Dog Of Flanders,6.4,6
7000000,7.051521,2062066,104,A day without sex is a day wasted.,Auto Focus,6.1,56
7000000,11.400229,0,90,"When Andy met Edie, life imitated art.",Factory Girl,6.2,81
7000000,21.276864,6038942,112,,We Need to Talk About Kevin,7.4,677
0,1.799504,0,100,Believe the Miracle,The Christmas Candle,5.8,8
7000000,2.932784,0,102,,The Mighty Macs,5,15
7000000,2.550045,1246141,100,The last word about the first time.,Losin' It,4.5,31
7000000,5.517597,0,125,,Mother and Child,6.7,46
0,3.829937,0,107,,March or Die,6.2,16
0,8.893676,0,107,They Weren't Born Yesterday!,The Visitors,7.1,420
8000000,9.590373,0,98,,Somewhere,6,208
7000000,7.155519,1429299,106,,I Hope They Serve Beer in Hell,5.7,20
0,0.587276,0,95,Work sucks!,Chairman of the Board,2.7,13
7000000,13.635828,382946,106,Sometimes life gives you the finger and sometimes it gives you...,Hesher,6.7,212
0,10.416332,523511,93,I want my money plus interest.... and a present,Dom Hemingway,5.8,212
3500000,5.038953,0,103,,Gerry,6.2,68
7000000,1.498245,0,96,,The Heart of Me,7.7,5
7000000,8.184588,573335,103,A true story of love and injustice.,Freeheld,7.1,164
7000000,2.26778,453079,108,"They're not gigolos, they're gentlemen.",The Extra Man,5.9,29
7000000,3.120016,1310673,170,,Hard to Be a God,6.7,41
7000000,8.207425,46488,108,,Ca$h,6,73
0,2.356244,0,120,Every family has its own language,Wah-Wah,6.3,8
6000000,34.917447,30471,108,Thy Kingdom Come. Thy Will Be Done.,The Boondock Saints,7.2,837
0,0.542814,0,92,,Z Storm,5.8,5
7000000,5.060656,0,84,"Between the living and the dead, eviil is waiting.",Twixt,5,85
7000000,5.33861,12400000,76,"Cold can freeze your heart, love can set you free",The Snow Queen,5.1,47
0,1.874783,0,53,,Alpha and Omega: The Legend of the Saw Tooth Cave,6.5,4
0,14.574995,41410568,115,... and hell followed with him.,Pale Rider,7,251
7000000,8.591387,8900000,97,The lines have been drawn. The battle has been waged. Only one thing can save us...,Stargate: The Ark of Truth,6.9,140
6900000,26.181753,7993039,102,See it with a bud.,Dazed and Confused,7.4,583
0,21.01755,7000000,104,,High School Musical 2,6.1,843
0,3.139294,0,96,,Two Lovers and a Bear,6.8,27
7000000,6.665164,0,94,Leave the crime to the criminals,Criminal Activities,5.8,110
0,2.832628,0,125,,Aimee & Jaguar,6.3,20
0,3.528643,0,108,Fear. Trust. Love.,The Chumscrubber,6.7,62
6800000,4.665309,0,101,"Lie, cheat, steal... your deal!",Shade,6.1,73
6900000,25.613197,44287131,101,Fear reaches out... for the girl next door.,House at the End of the Street,5.6,555
6800000,21.285206,7103838,130,The search began at the opening of their mother's will.,Incendies,7.9,479
0,4.240495,0,125,Some loves are never forgotten,"Remember Me, My Love",5.8,44
0,3.810943,0,88,Blood is thicker than water. Nothing is thicker than thieves.,Perrier’s Bounty,5.1,24
4000000,23.604936,0,115,On the streets of Rio only the elite survive,Elite Squad,7.8,504
6500000,60.225219,255273813,99,"Before the Conjuring, there was Annabelle.",Annabelle,5.6,1517
7,0.050456,7,82,Bran Nue Dae,Bran Nue Dae,5.2,6
6500000,17.705671,57504069,112,Once upon a time in South Central L.A... It ain't no fairy tale.,Boyz n the Hood,7.4,364
6500000,6.847099,54215416,108,Born into poverty. Destined for stardom. He lived the American dream.,La Bamba,6.8,116
0,8.067702,0,107,,The Four Seasons,6.3,16
6500000,11.208769,31899000,105,The Latest Fashion In Murder,Dressed to Kill,6.8,157
6500000,2.163683,0,108,For anyone who has ever dreamed of running away from it all,The Adventures of Huck Finn,6.2,42
6500000,11.142389,28451622,98,A weekend wasted is never a wasted weekend.,Go,7,196
6500000,11.885221,13368437,88,,Friends with Money,5.1,128
6500000,12.524953,12376563,131,The picture runs 130 minutes!... The story covers 96 of the most critical hours in man's history!... The suspense will last through your lifetime!,The Andromeda Strain,7,190
0,1.537859,10,91,They will suck you dry,Bats,4.1,35
0,3.481517,0,140,One family's tale of a homeland lost... and a homeland found.,Nowhere in Africa,7,32
6500000,40.688426,17693675,100,,Shame,7,875
6500000,24.0034,11850214,105,,Layer Cake,7,559
6500000,2.639106,2025032,100,,The Work and the Glory II: American Zion,8,6
6500000,16.574756,2401510,116,"Spy on us, we'll spy on you.",The East,6.5,305
6500000,5.483531,1548955,96,Family can be whatever you want it to be.,A Home at the End of the World,6.8,45
0,1.068819,0,113,,Aberdeen,7,6
6500000,8.432401,1521261,113,The Scars of War Will Last Forever,The Messenger,7.1,119
6500000,2.074295,0,102,,Tracker,6,16
0,11.357474,8159508,121,,Control,7.5,200
6400000,74.234793,78371200,108,Your future is in his hands.,The Terminator,7.3,4128
4800000,11.086001,79384880,121,The German Democratic Republic lives on -- in 79 square meters!,"Good bye, Lenin!",7.4,586
10000000,13.409125,0,97,They love me for what I'm not... ...they hate me for what I am.,The Damned United,7.2,152
4000000,14.961629,14237000,91,They're Back From The Grave and Ready To Party!,The Return of the Living Dead,7.3,267
6000000,16.139771,2122561,94,They're not there to shop. They're not there to work. They're just there.,Mallrats,6.8,392
6000000,67.608041,181813770,110,Grease is the word,Grease,7.2,1581
6000000,49.802914,138530565,120,The first casualty of war is innocence.,Platoon,7.5,1205
6000000,16.20985,119114517,122,Controversy... what controversy?,Fahrenheit 9/11,6.8,397
6000000,24.499996,102308889,110,"Not that it matters, but most of it is true.",Butch Cassidy and the Sundance Kid,7.4,650
6000000,59.961523,102272727,139,It's supercalifragilisticexpialidocious!,Mary Poppins,7.4,1183
6000000,12.541983,0,124,Everything is in its proper place...except the past.,Ordinary People,7.4,145
6000000,23.431117,43656822,152,The screen achieves one of the great entertainments in the history of motion pictures,West Side Story,7,389
6000000,15.929648,39846344,98,The snobs against the slobs!,Caddyshack,6.6,365
0,3.029944,0,106,,The Brothers,6.5,10
6000000,5.537646,25059640,106,From best friends to best men.,The Wood,7.1,34
6000000,64.025031,23341568,106,Five Criminals. One Line Up. No Coincidence.,The Usual Suspects,8.1,3254
8000000,12.654051,22168359,89,"Now Freddy’s a daddy, he’s killing for two.",A Nightmare on Elm Street 5: The Dream Child,5.5,245
5000000,35.108498,38275483,92,Don't Graduate. Celebrate.,National Lampoon’s Van Wilder,5.9,858
6000000,40.196514,44703995,109,Love. Pain. Glory.,The Wrestler,7.3,1000
6000000,7.60445,20400000,144,Emotions . . . As Violent As The Wind-Swept Prairie !,Duel in the Sun,6.2,37
0,10.982255,0,90,Some pets deserve a little more respect than others.,Best in Show,6.7,166
6000000,24.351305,50244700,99,1997. New York City is now a maximum security prison. Breaking out is impossible. Breaking in is insane.,Escape from New York,6.9,703
0,3.159574,0,121,,School Daze,6.2,26
6000000,12.601677,18197398,89,The summer is going to be in tents.,Daddy Day Camp,4.4,91
12716953,7.077505,18814720,113,Fight first. Apologize later.,Mr. Nice Guy,6.3,128
6000000,4.053017,18750246,91,"Back together for the first time, again.",A Mighty Wind,6.6,74
0,6.379933,0,104,A Romantic Comedy With The Works,Mystic Pizza,5.9,123
6000000,15.639016,58000000,99,What if one split second sent your life in two completely different directions?.,Sliding Doors,6.5,354
6000000,3.89204,12000000,98,Chill or be Chilled,Tales from the Hood,5.4,32
6000000,26.286954,48027970,121,Charming. Magnetic. Murderous.,The Last King of Scotland,7.4,558
5000000,8.008844,11642254,96,"Michael Lives, And This Time They're Ready!",Halloween 5: The Revenge of Michael Myers,5.2,183
5000000,12.68514,9206470,100,A story so unbelievable it must be true.,Bernie,6.5,320
6000000,0.041651,7518876,42,,Dolphins and Whales: Tribes of the Ocean,8,3
0,8.483531,0,122,A true portrait of life and art.,Pollock,6.6,91
6000000,3.561198,6852450,101,It's 11:59 on New Years Eve... do you know where your date is?,200 Cigarettes,6.1,44
6000000,14.988746,13231461,96,There's more than one way to take a life.,The Words,6.4,379
0,5.754416,0,84,Funniest movie you'll ever read.,Casa De Mi Padre,5.5,103
6000000,6.497285,6670712,104,Truth is stranger than family,City Island,6.9,113
6000000,19.411141,19560274,96,The FBI are about to discover that things work a little differently around here.,The Guard,6.8,372
7000000,7.034618,6230276,94,,College,4.8,48
6000000,26.218912,10409377,97,"Beautiful, mysterious, haunting, invariably fatal. Just like life.",The Virgin Suicides,7.1,817
0,4.647547,0,97,Finding your own voice can be magic.,Little Voice,6.6,61
0,9.371534,0,89,"After four years in a coma, Eugene Pratt is going to be reunited with his high school sweetheart... on pages 95-97.",Miss March,5.4,77
5500000,15.015271,5483299,120,Life is an occasion. Rise to it.,Wish I Was Here,6.4,300
6000000,5.696491,4398989,95,Magic opened up their hearts... Love did the rest.,Simply Irresistible,5.5,52
0,4.25422,0,95,An anatomically incorrect rock odyssey,Hedwig and the Angry Inch,7.4,80
6000000,5.411243,3283371,99,The ultimate martial art.,Only the Strong,6.9,29
0,1.273773,0,96,Be Careful Who You Get Close To,Goddess of Love,6.2,9
6000000,6.27257,2944752,94,,Shattered Glass,6.6,111
6000000,4.148253,2025238,95,,Novocaine,6,44
0,1.369649,0,84,,The Business of Strangers,5.7,19
6244087,14.970654,638641,145,"If you only want to spend two hours in a movie theatre and go home and forget it, stay away from THE WILD BUNCH.",The Wild Bunch,7.6,259
6000000,7.161051,2899975,99,,The Wackness,6.2,94
6000000,12.434688,0,110,Never have so few taken so much from so many.,The First Great Train Robbery,6.6,74
0,2.507912,0,97,,Morvern Callar,7.2,34
6000000,1.478505,869325,107,,Beastmaster 2: Through the Portal of Time,4.6,17
6000000,0.215464,399611,97,Rising from tragedy to triumph,The 5th Quarter,4.7,12
0,1.229667,0,104,,The Flower of Evil,5.7,10
6000000,6.903186,0,99,,The Greatest,6.2,34
134005,2.260315,1332231,104,,Snow Flower and the Secret Fan,5.3,22
6000000,3.427061,0,97,"Before you fall in love, you need to love yourself.",Come Early Morning,5.9,10
0,0.669169,0,107,,Lucky Break,6.5,11
0,6.077735,0,117,The story of two women whose friendship suddenly became a matter of life and death.,Julia,6.3,30
6000000,2.404626,69497,85,,"Surfer, Dude",4.7,25
0,0.475748,25,152,Exploring the Issue that Divides the World,Lake of Fire,8,10
6000000,15.048067,0,86,Fate can change in seconds.,11:14,6.8,206
0,1.734764,0,103,"Killers for hire are paid for what they can do, not for what they believe... until today.",Men of War,5.4,29
0,1.496454,0,87,Some secrets are better left buried.,Don McKay,5.4,21
12000000,10.19041,66351,95,Twisty thriller... a wild ride.,Deadfall,5.6,224
6000000,12.099486,0,101,An abandoned child brings the colors of love into their lives.,A Shine of Rainbows,6.3,14
6000000,4.957014,0,90,Who's on your list?,The Hit List,5.2,73
0,2.135689,0,240,,Emma,7.6,38
5952000,18.119265,2120439,87,First it controls your mind. Then it destroys your body.,Videodrome,7.1,454
5300000,13.034602,3897799,122,"They came from Paris, Rome, London and Berlin to... the Spanish Apartment... where a year can change a lifetime.",The Spanish Apartment,7,266
6000000,6.349218,32251,86,A moment can change everything.,Song One,5.5,87
4000000,5.013575,530048,103,"In 1945 Holland, a boy must choose between good and evil.",Winter in Wartime,6.8,66
0,4.448353,0,90,Crime is such a trippy thing,Freaky Deaky,4.9,18
5800000,4.49029,6800000,133,"It carried their hopes, their nation's honour!",The Train,7.2,72
0,2.204138,0,91,Justice needs a hero,Trade Of Innocents,5.5,12
6000000,11.81832,27165581,108,Vengeance Knows No Mercy,The Protector,6.8,167
0,0.356495,0,99,,Stiff Upper Lips,10,1
3500159,22.054546,76578641,112,"Sometimes, to follow your dreams... you've got to bend the rules!",Bend It Like Beckham,6.2,578
0,4.245123,0,141,Greetings from ...,Sunshine State,6,10
5800000,3.201886,7000000,95,,Crossover,4.2,10
0,0.114342,126,139,,Khiladi 786,4.7,11
5600000,22.341462,18469680,85,Fear Revisited,[REC]²,6.4,489
0,0.305922,531826,105,Dance - Sing - Dream,Standing Ovation,3.9,6
5500000,28.500913,159616327,129,...all it takes is a little confidence.,The Sting,7.9,622
5500000,10.439971,58972904,123,"This is the story of two men who run, not to run, but to prove something to the world. They will sacrifice anything to achieve their goals... except their honor.",Chariots of Fire,6.8,207
0,3.784535,0,116,Time heals the heart. Faith heals the rest.,Diary of a Mad Black Woman,6.4,71
0,10.396305,0,105,A true story of the mystery of music and the miracle of love,Shine,7.3,131
6000000,33.296684,0,90,Everyone loves a happy ending.,Don Jon,5.9,1671
5500000,19.127239,15700000,105,Welcome to Hell,High Plains Drifter,7.4,278
7000000,14.072941,0,111,Accentuate the negative.,Ghost World,7.1,426
0,2.714043,0,91,,Iris,6.2,47
5500000,2.141143,4865000,95,She's too good to be true...and too real to be otherwise.,Galaxina,3.3,16
0,20.982455,0,96,,The Chorus,7.5,526
4361898,2.080741,3031801,92,Things change. Family doesn't.,Mambo Italiano,5.6,28
5000000,7.79068,2466444,104,"Sex, drugs, murder. Welcome to L.A.",Wonderland,6.2,73
6500000,15.580335,37295445,120,"It's the hottest day of the summer. You can do nothing, you can do something, or you can...",Do the Right Thing,7.6,292
0,5.336243,0,99,"Passion, Seduction, Deception.",Harvard Man,4.8,15
3850000,10.787322,0,93,,Le Havre,6.8,97
0,32.476098,792,97,Time destroys everything.,Irreversible,7.1,538
5500000,3.21392,0,100,M For Father,R100,5.4,31
2200000,5.206967,11502151,157,A Generation Awakens,Rang De Basanti,7.2,97
0,1.5846,0,90,,Animals,6.2,9
8000000,3.653305,0,96,Faith alone doesn’t cut it anymore,Salvation Boulevard,5.6,28
0,3.865122,0,96,"If He'd meant the commandments literally, He'd have written them in stone.",The Ten,4.9,57
0,1.391958,0,90,,A Room for Romeo Brass,7.3,18
0,20.821846,15699707,100,The hunt is on.,Headhunters,7.1,399
0,9.451228,0,94,"For the locals on Erin Island, it's last orders.",Grabbers,6,140
0,1.688495,0,95,He's hoping for a miracle. He doesn't have a prayer.,Saint Ralph,7.3,24
5500000,5.033065,5000000,120,Love is a foolish game,Miss Julie,5.9,45
5100000,5.934016,0,103,Beyond fantasy. Beyond obsession. Beyond time itself... he will find her.,Somewhere in Time,7.2,102
0,0.075817,0,130,Goa. Paradise on Earth. But every Paradise has a few snakes.,Dum Maaro Dum,5.4,7
5000000,48.375848,0,106,It will take what you love most.,Insidious: Chapter 2,6.5,1211
4000000,42.187986,152925093,92,Oh Yes... There Will Be Blood.,Saw II,6.3,1251
15000000,53.698683,108286421,103,Monsters come in many forms.,10 Cloverfield Lane,6.8,2468
5000000,14.752587,64282312,87,Do not attempt this at home.,Jackass: The Movie,6.1,345
4900000,48.170508,44107032,81,,Lights Out,6.3,1129
5000000,29.15813,205703818,83,It Runs In The Family,Paranormal Activity 3,5.9,669
5000000,56.30466,103590271,89,Keep telling yourself it's just a game,Ouija,4.9,983
5000000,17.304055,44793222,96,"If you think you're ready for Freddy, think again!",A Nightmare on Elm Street 3: Dream Warriors,6.5,354
5500000,9.59729,99067206,115,Life doesn't care if you're ready.,Instructions Not Included,7.5,205
5000000,20.326337,142817992,95,It's closer than you think,Paranormal Activity 4,5.2,563
4100000,4.028875,36000000,135,The first motion picture in CinemaScope--the modern miracle you see without glasses!,The Robe,6.4,42
5000000,6.470766,41833347,113,,The Return of the Pink Panther,6.7,137
11000000,16.856231,34872033,89,They saved the best for last.,Freddy's Dead: The Final Nightmare,5.1,272
8000000,19.683187,60378584,110,The first female serial killer of America,Monster,7,485
5000000,9.358197,28200000,127,The mightiest motion picture of them all!,"20,000 Leagues Under the Sea",6.8,157
5000000,19.984477,86362372,84,You're one of us now.,Paranormal Activity: The Marked Ones,5.2,449
5000000,30.271066,26010864,124,I am not an animal! I am a human being! I... am... a man!,The Elephant Man,7.9,719
5000000,59.454473,55198285,117,Sometimes it takes a hustler to change the world,Dallas Buyers Club,7.9,2886
3300000,20.304235,64110728,83,Evil will rise.,The Lazarus Effect,5.1,505
9000000,60.715151,39723096,113,Some memories are best forgotten.,Memento,8.1,4028
5000000,35.871248,44030246,104,You see what it wants you to see,Oculus,6.3,1050
5000000,18.077963,26888376,97,With No Power Comes No Responsibility,Clerks II,6.9,398
5000000,20.428237,110000000,110,Inside every one of us is a special talent waiting to come out. The trick is finding it.,Billy Elliot,7.4,750
4600000,32.14444,23198652,103,We've all been there.,The Way Way Back,7.1,688
0,3.673566,0,94,,House Party 2,4.7,21
3500000,3.656491,20659423,104,The story of a boy suddenly alone in the world. The men who challenge him. And the girl who helps him become a man.,The Man from Snowy River,6.8,37
0,1.88484,0,77,You'll Dig Doug!,Doug's 1st Movie,5.4,22
5000000,4.227807,0,134,The hardest soul to save was his own.,The Apostle,6.1,38
0,3.102862,0,129,The meanest mother of them all,Mommie Dearest,6.5,54
10000000,15.688439,17273593,90,Everybody has one,Our Idiot Brother,5.9,365
5000000,22.9951,24804129,134,The incredible true story of gold medal champion Jesse Owens,Race,7.1,478
0,5.769822,0,104,"Here, we get down and dirty.",The Players Club,6.4,14
5000000,26.510558,40100000,93,The only way out is down.,"As Above, So Below",6.1,766
0,7.544515,0,105,Every Woman Needs an Escape,Addicted,5.4,63
0,1.126941,0,109,The secrets that hold us together can also tear us apart.,Eve's Bayou,6.1,27
5000000,35.307577,43884652,99,,Still Alice,7.5,1104
5000000,4.079111,15000000,139,"To Nefer, shameless temptress of Babylon, he surrendered his parents' hope of immortality!",The Egyptian,6,11
5000000,7.058868,19905359,99,A terrorist holds New York in a grip of fear - and only Stallone can take him on.,Nighthawks,6.4,86
5000000,12.904615,14000000,100,The Big Apple's in BIG trouble!,Friday the 13th Part VIII: Jason Takes Manhattan,4.8,191
5000000,18.115566,368744044,95,Love is here to stay... so is her family.,My Big Fat Greek Wedding,6.2,671
5000000,62.554173,31724284,94,A little sun can bring out your dark side.,Spring Breakers,5,1551
5000000,9.483717,15116634,88,Haddonfield is ready to celebrate Halloween.... so is Michael Myers!,Halloween: The Curse of Michael Myers,5,170
5000000,16.890285,33616692,106,Life has its ways of teaching. Life has its ways to confuse us. Life has its ways to move us. Life has its ways to amaze. Life has its ways to hurt us. Life has its ways to heal. Life has its ways to inspire.,Y Tu Mamá También,7.3,315
4000000,49.12486,30039392,99,A romantic comedy. With zombies.,Shaun of the Dead,7.5,2420
0,8.309894,0,82,Her past is yet to come.,The Haunting of Molly Hartley,4.3,48
5000000,5.960149,13269963,135,John Sayles invites you to return to the scene of the crime.,Lone Star,6.9,77
5000000,9.302349,17768757,88,Horror has returned to Haddonfield.,Halloween 4: The Return of Michael Myers,5.9,209
5000000,8.190888,0,89,Childish pranks turn into a bloody battle for survival!,April Fool's Day,5.8,73
0,5.87193,0,110,"Suddenly, life was more than French fries, gravy, and girls.",Diner,6.9,83
5000000,8.452666,12232628,107,The 'Mad Dog' Criminal...The 'Lone Wolf' Lawman...The Ultimate Showdown.,Lone Wolf McQuade,5.5,67
5000000,17.028252,25562924,86,There's a reason we've never gone back to the moon.,Apollo 18,5,356
5000000,19.336367,16174377,102,life's a messy business.,Sunshine Cleaning,6.5,255
5000000,38.006982,54418872,103,No rescue. No refuge.,No Escape,6.7,777
0,6.377523,14056528,118,"Born with the courage of an eagle, the strength of a black tiger, and the power of a god.",The Beastmaster,6,97
5000000,0.835617,12200000,139,Only once in 3000 years...anything like...,Solomon and Sheba,5.4,8
20000000,14.947588,21164799,92,Way shadier than gray.,Fifty Shades of Black,4.3,331
0,5.1299,0,99,,Not Easily Broken,6.3,9
4,1.199451,25,89,Every woman who has loved will understand,A Farewell to Arms,6.2,28
0,3.810827,0,96,t's what everyone's looking for,The Perfect Match,5.2,42
5500000,3.7387,0,82,,Digimon: The Movie,6.2,72
0,9.85123,0,92,,Saved!,6.3,147
8000000,3.03091,3432342,99,"A provocative new comedy about sex, friendship, and all other things that invade our lives.",The Barbarian Invasions,6.7,77
0,3.199904,0,106,Love is the greatest adventure of all.,Robin and Marian,6.6,50
5000000,2.739307,0,90,The night... has an appetite.,The Forsaken,4.9,47
5000000,5.348446,7230000,118,,Force 10 from Navarone,6.4,91
5000000,4.070044,0,97,"A lot of TV stations have forgotten what ""quality"" means, but not Channel 62. They NEVER knew what it meant.",UHF,6.7,89
0,9.974681,6538177,94,A movie that proves you're never too old to come of age.,Grandma's Boy,6.6,220
5000000,6.308298,0,91,Growing Up is Hard to Do,Slums of Beverly Hills,6.5,44
5000000,49.333137,5321508,175,There were three men in her life. One to take her... one to love her... and one to kill her.,Once Upon a Time in the West,8.1,1128
5000000,4.149628,5476060,94,Welcome to disorganized crime.,Made,6.3,55
5000000,46.114184,9760104,97,The last place you'd ever expect to find yourself.,Moon,7.6,1794
0,3.562563,0,90,A 13-year-old boy uses his upcoming bar mitzvah to reconcile the strained relationship between his father and grandfather.,Keeping Up with the Steins,5.2,18
5000000,4.498368,4074023,41,The T-Rex of the Seas come alive.,Sea Rex 3D: Journey to a Prehistoric World,5.9,11
5000000,7.673124,3263585,112,There is no such thing as the simple truth.,The Sweet Hereafter,6.8,103
4000000,4.992475,41424067,120,"In the face of terror, their greatest weapon was faith...",Of Gods and Men,6.5,91
5000000,6.174435,4040588,110,"Based on a true story of love, victory, and fermentation",Bottle Shock,6.6,60
0,0.805312,0,87,The comedy that examines modern living through chemistry,Jekyll and Hyde ... Together Again,4.6,5
5000000,8.753409,3049135,99,From a secret world no one could see... came a crime no one could believe.,Heavenly Creatures,7,294
5000000,3.943706,4842699,121,Hope lives,90 Minutes in Heaven,5.4,40
5000000,9.169411,2614773,97,Lost is a good place to find yourself,Everything Must Go,6,208
5000000,2.732031,1980338,116,The world's most private detective.,Zero Effect,6,55
5000000,35.252056,8203235,101,A little guilt goes a long way...,The Machinist,7.3,1247
5000000,6.063868,0,103,He was a good man in a deadly business. She was his only way out.,Light Sleeper,5.7,15
5000000,21.343093,2450846,112,Can you keep a national secret?,Kill the Messenger,6.6,355
5000000,10.095184,5129058,91,The only way out is through.,Rabbit Hole,6.9,165
5000000,4.129165,742898,98,'Til death do they party...,Party Monster,5.9,58
5000000,30.001024,3220371,95,One way in. No way out.,Green Room,6.7,683
5000000,6.759235,0,88,One woman's story is about to climax.,The Oh in Ohio,5.8,27
5000000,1.731035,846704,99,Who is John Galt?,Atlas Shrugged Part III: Who is John Galt?,3.9,15
7000000,11.700578,560069,91,"They're not really criminals, but everyone's got to have a dream.",Bottle Rocket,6.8,281
6000000,2.388683,0,97,They Planned The Perfect Crime... Until It All Went Perfectly Wrong!,Albino Alligator,5.6,45
0,0.080704,0,136,To the People...He was a Father. To his Son...he was a Father he never had.,"Gandhi, My Father",6,2
0,0.888986,0,117,,Standard Operating Procedure,6.6,14
0,0.679351,0,94,A harrowing drama from the director of Easy Rider,Out of the Blue,6.5,17
5000000,19.940245,5476793,89,Evil just messed with the wrong hillbillies.,Tucker and Dale vs Evil,7.3,847
0,1.286991,0,92,"Something mysterious, new, unexpected and lovely is happening to Robert Malone.","Lovely, Still",6.2,13
0,0.042442,0,128,Breath-taking Adventure !,Tycoon,6.6,4
0,1.116206,0,90,"Once You Get There, You'll Never Want To Leave",Desert Blue,5.5,9
5000000,3.05434,0,95,They can seduce anyone... Prey it isn't you!,Decoys,4.7,33
5000000,38.94708,98450062,94,No one loves you like your grandparents.,The Visit,6,1360
5000000,3.792015,782102,90,,Redacted,6.2,37
0,0.219799,0,95,,Fascination,3.8,4
5000000,7.794,0,91,,Area 51,4.2,151
5000000,9.136965,0,107,Someone is watching over you,Sleep Tight,7,202
0,8.39685,0,92,Sleeps Six Bloody Comfortably,The Cottage,6.3,80
0,7.864905,0,87,,Dead Like Me: Life After Death,5.8,65
0,1.963219,0,80,What Happens In Antarctica... Stays in Antarctica,Farce of the Penguins,3.2,13
0,1.546169,0,95,It's about the music,Flying By,7,2
5000000,10.619574,0,105,The way back begins with a single chord.,Rudderless,7.4,105
5000000,0.999655,0,67,,Henry & Me,3,3
0,1.985243,0,95,They'll be home for Christmas...if only in their dreams.,Christmas Eve,6.1,24
0,0.102003,0,89,,We Have Your Husband,5,3
